<!--
  ~ Copyright 2009 Denys Pavlov, Igor Azarnyi
  ~
  ~    Licensed under the Apache License, Version 2.0 (the "License");
  ~    you may not use this file except in compliance with the License.
  ~    You may obtain a copy of the License at
  ~
  ~        http://www.apache.org/licenses/LICENSE-2.0
  ~
  ~    Unless required by applicable law or agreed to in writing, software
  ~    distributed under the License is distributed on an "AS IS" BASIS,
  ~    WITHOUT WARRANTIES OR CONDITIONS OF ANY KIND, either express or implied.
  ~    See the License for the specific language governing permissions and
  ~    limitations under the License.
  -->

<import-descriptor xmlns:xsi="http://www.w3.org/2001/XMLSchema-instance"
                   xsi:noNamespaceSchemaLocation="file:../../../../../../../domain-api/src/main/resources/META-INF/schema/import-descriptor-csv.xsd">

    <entity-type>org.yes.cart.domain.entity.Product</entity-type>

    <import-file-descriptor>
        <file-encoding>UTF-8</file-encoding>
        <file-name-mask>skipfktest001a.csv</file-name-mask>
        <ignore-first-line>true</ignore-first-line>
        <column-delimiter>;</column-delimiter>
        <text-qualifier>&quot;</text-qualifier>
    </import-file-descriptor>

    <select-sql>select p from ProductEntity p where p.guid = {guid}</select-sql>

    <import-columns>

        <!-- Primary key -->
        <column-descriptor>
            <column-index>0</column-index>
            <field-type>FIELD</field-type>
            <name>guid</name>
            <value-regex>(.{0,255})(.*)</value-regex>
            <value-regex-group>1</value-regex-group>
        </column-descriptor>

        <!-- SKU code -->
        <column-descriptor>
            <column-index>0</column-index>
            <field-type>FIELD</field-type>
            <name>code</name>
            <value-regex>(.{0,255})(.*)</value-regex>
            <value-regex-group>1</value-regex-group>
        </column-descriptor>

        <!-- Manufacturer code -->
        <column-descriptor>
            <column-index>0</column-index>
            <field-type>FIELD</field-type>
            <name>manufacturerCode</name>
            <value-regex>(.{0,255})(.*)</value-regex>
            <value-regex-group>1</value-regex-group>
        </column-descriptor>

        <!-- brand -->
        <column-descriptor>
            <column-index>1</column-index>
            <field-type>FK_FIELD</field-type>
            <entity-type>org.yes.cart.domain.entity.Brand</entity-type>
            <name>brand</name>
            <value-regex>(.{0,255})(.*)</value-regex>
            <value-regex-group>1</value-regex-group>
            <lookup-query>select b from BrandEntity b where b.name = {brand}</lookup-query>
            <update-skip-unresolved>true</update-skip-unresolved>
        </column-descriptor>

        <!-- product type -->
        <column-descriptor>
            <column-index>2</column-index>
            <field-type>FK_FIELD</field-type>
            <entity-type>org.yes.cart.domain.entity.ProductType</entity-type>
            <name>producttype</name>
            <value-regex>(.{0,255})(.*)</value-regex>
            <value-regex-group>1</value-regex-group>
            <lookup-query>select pt from ProductTypeEntity pt where pt.name = {producttype}</lookup-query>
            <insert-only>true</insert-only>
        </column-descriptor>

        <!--  Productname -->
        <column-descriptor>
            <column-index>3</column-index>
            <field-type>FIELD</field-type>
            <name>name</name>
            <value-regex>(.{0,255})(.*)</value-regex>
            <value-regex-group>1</value-regex-group>
            <insert-only>true</insert-only>
        </column-descriptor>

        <column-descriptor>
            <column-index>4</column-index>
            <field-type>FIELD</field-type>
            <name>displayName</name>
            <language>en</language>
            <value-regex>(.{0,255})(.*)</value-regex>
            <value-regex-group>1</value-regex-group>
        </column-descriptor>

        <column-descriptor>
            <column-index>5</column-index>
            <field-type>FIELD</field-type>
            <name>displayName</name>
            <language>ru</language>
            <value-regex>(.{0,255})(.*)</value-regex>
            <value-regex-group>1</value-regex-group>
        </column-descriptor>

        <!-- Description -->
        <column-descriptor>
            <column-index>6</column-index>
            <field-type>FIELD</field-type>
            <name>description</name>
            <value-regex>(.{0,4000})(.*)</value-regex>
            <value-regex-group>1</value-regex-group>
        </column-descriptor>

        <column-descriptor>
            <column-index>7</column-index>
            <field-type>SLAVE_INLINE_FIELD</field-type>
            <name/>
            <import-descriptor>
                <mode>INSERT_ONLY</mode>
                <entity-type>org.yes.cart.domain.entity.AttrValueProduct</entity-type>
                <import-file-descriptor>
                    <file-encoding>UTF-8</file-encoding>
                    <file-name-mask/>
                    <ignore-first-line>false</ignore-first-line>
                    <column-delimiter>,</column-delimiter>
                    <text-qualifier>&quot;</text-qualifier>
                </import-file-descriptor>
                <select-sql/>
                <insert-sql>
                    DELETE FROM TPRODUCTATTRVALUE
                        WHERE GUID = '{masterObjectId}_PRODDESC_en';
                    INSERT INTO TPRODUCTATTRVALUE (VERSION, PRODUCT_ID, GUID, CODE, VAL)
                        VALUES (0, {masterObjectId}, '{masterObjectId}_PRODDESC_en', 'PRODUCT_DESCRIPTION_en','{val}')
                </insert-sql>
                <import-columns>
                    <column-descriptor>
                        <column-index>7</column-index>
                        <field-type>FIELD</field-type>
                        <name>val</name>
                    </column-descriptor>
                </import-columns>
            </import-descriptor>
        </column-descriptor>

        <column-descriptor>
            <column-index>8</column-index>
            <field-type>SLAVE_INLINE_FIELD</field-type>
            <name/>
            <import-descriptor>
                <mode>INSERT_ONLY</mode>
                <entity-type>org.yes.cart.domain.entity.AttrValueProduct</entity-type>
                <import-file-descriptor>
                    <file-encoding>UTF-8</file-encoding>
                    <file-name-mask/>
                    <ignore-first-line>false</ignore-first-line>
                    <column-delimiter>,</column-delimiter>
                    <text-qualifier>&quot;</text-qualifier>
                </import-file-descriptor>
                <select-sql/>
                <insert-sql>
                    DELETE FROM TPRODUCTATTRVALUE
                        WHERE GUID = '{masterObjectId}_PRODDESC_ru';
                    INSERT INTO TPRODUCTATTRVALUE (VERSION, PRODUCT_ID, GUID, CODE, VAL)
                        VALUES (0, {masterObjectId}, '{masterObjectId}_PRODDESC_ru', 'PRODUCT_DESCRIPTION_ru','{val}')
                </insert-sql>
                <import-columns>
                    <column-descriptor>
                        <column-index>8</column-index>
                        <field-type>FIELD</field-type>
                        <name>val</name>
                    </column-descriptor>
                </import-columns>
            </import-descriptor>
        </column-descriptor>

    </import-columns>
</import-descriptor>